root@varun-desktop:/home/varun/Desktop# mysql -uroot -p
Enter password: 
Welcome to the MySQL monitor.  Commands end with ; or \g.
Your MySQL connection id is 13
Server version: 5.7.27-0ubuntu0.18.04.1 (Ubuntu)

Copyright (c) 2000, 2019, Oracle and/or its affiliates. All rights reserved.

Oracle is a registered trademark of Oracle Corporation and/or its
affiliates. Other names may be trademarks of their respective
owners.

Type 'help;' or '\h' for help. Type '\c' to clear the current input statement.

mysql> show databases;
+--------------------+
| Database           |
+--------------------+
| information_schema |
| employee           |
| mysql              |
| performance_schema |
| sys                |
+--------------------+
5 rows in set (0.00 sec)

mysql> create database student;
Query OK, 1 row affected (0.00 sec)

mysql> use student;
Database changed
mysql> create table student(usn varchar(10),name varchar(20),sem integer,sec char(1));
Query OK, 0 rows affected (0.23 sec)

mysql> desc student;
+-------+-------------+------+-----+---------+-------+
| Field | Type        | Null | Key | Default | Extra |
+-------+-------------+------+-----+---------+-------+
| usn   | varchar(10) | YES  |     | NULL    |       |
| name  | varchar(20) | YES  |     | NULL    |       |
| sem   | int(11)     | YES  |     | NULL    |       |
| sec   | char(1)     | YES  |     | NULL    |       |
+-------+-------------+------+-----+---------+-------+
4 rows in set (0.00 sec)

mysql> insert into student values('4mh17cs087','shirish',5,'c');
Query OK, 1 row affected (0.03 sec)

mysql> insert into student values('4mh17cs001','subramanya',5,'b');
Query OK, 1 row affected (0.02 sec)

mysql> insert into student values('4mh17cs102','supreeth',5,'c');
Query OK, 1 row affected (0.02 sec)

mysql> insert into student values('4mh17cs070','rohith',5,'b');
Query OK, 1 row affected (0.03 sec)

mysql> insert into student values('4mh17cs068','thushar',5,'a');
Query OK, 1 row affected (0.03 sec)

mysql> select * from student;
+------------+------------+------+------+
| usn        | name       | sem  | sec  |
+------------+------------+------+------+
| 4mh17cs087 | shirish    |    5 | c    |
| 4mh17cs001 | subramanya |    5 | b    |
| 4mh17cs102 | supreeth   |    5 | c    |
| 4mh17cs070 | rohith     |    5 | b    |
| 4mh17cs068 | thushar    |    5 | a    |
+------------+------------+------+------+
5 rows in set (0.00 sec)

mysql> select * from student;
+------------+------------+------+------+
| usn        | name       | sem  | sec  |
+------------+------------+------+------+
| 4mh17cs087 | shirish    |    5 | c    |
| 4mh17cs001 | subramanya |    5 | b    |
| 4mh17cs102 | supreeth   |    5 | c    |
| 4mh17cs070 | rohith     |    5 | b    |
| 4mh17cs068 | thushar    |    5 | a    |
+------------+------------+------+------+
5 rows in set (0.00 sec)

mysql> select * from student where sec='b' or sec='c';
+------------+------------+------+------+
| usn        | name       | sem  | sec  |
+------------+------------+------+------+
| 4mh17cs087 | shirish    |    5 | c    |
| 4mh17cs001 | subramanya |    5 | b    |
| 4mh17cs102 | supreeth   |    5 | c    |
| 4mh17cs070 | rohith     |    5 | b    |
+------------+------------+------+------+
4 rows in set (0.00 sec)

mysql> select * from student where sec='a';
+------------+---------+------+------+
| usn        | name    | sem  | sec  |
+------------+---------+------+------+
| 4mh17cs068 | thushar |    5 | a    |
+------------+---------+------+------+
1 row in set (0.00 sec)

mysql> select * from student where sec!='a';
+------------+------------+------+------+
| usn        | name       | sem  | sec  |
+------------+------------+------+------+
| 4mh17cs087 | shirish    |    5 | c    |
| 4mh17cs001 | subramanya |    5 | b    |
| 4mh17cs102 | supreeth   |    5 | c    |
| 4mh17cs070 | rohith     |    5 | b    |
+------------+------------+------+------+
4 rows in set (0.00 sec)

mysql> select usn,name from student where sec='b' or sec='c';
+------------+------------+
| usn        | name       |
+------------+------------+
| 4mh17cs087 | shirish    |
| 4mh17cs001 | subramanya |
| 4mh17cs102 | supreeth   |
| 4mh17cs070 | rohith     |
+------------+------------+
4 rows in set (0.00 sec)

mysql> select count(*) from student;
+----------+
| count(*) |
+----------+
|        5 |
+----------+
1 row in set (0.00 sec)

mysql> update student 
    -> set sem=7
    -> where sec='b';
Query OK, 2 rows affected (0.03 sec)
Rows matched: 2  Changed: 2  Warnings: 0

mysql> select * from student;
+------------+------------+------+------+
| usn        | name       | sem  | sec  |
+------------+------------+------+------+
| 4mh17cs087 | shirish    |    5 | c    |
| 4mh17cs001 | subramanya |    7 | b    |
| 4mh17cs102 | supreeth   |    5 | c    |
| 4mh17cs070 | rohith     |    7 | b    |
| 4mh17cs068 | thushar    |    5 | a    |
+------------+------------+------+------+
5 rows in set (0.00 sec)

mysql> alter table student add fee float;
Query OK, 0 rows affected (0.51 sec)
Records: 0  Duplicates: 0  Warnings: 0

mysql> desc student;
+-------+-------------+------+-----+---------+-------+
| Field | Type        | Null | Key | Default | Extra |
+-------+-------------+------+-----+---------+-------+
| usn   | varchar(10) | YES  |     | NULL    |       |
| name  | varchar(20) | YES  |     | NULL    |       |
| sem   | int(11)     | YES  |     | NULL    |       |
| sec   | char(1)     | YES  |     | NULL    |       |
| fee   | float       | YES  |     | NULL    |       |
+-------+-------------+------+-----+---------+-------+
5 rows in set (0.00 sec)

mysql> update student set fee=50000;
Query OK, 5 rows affected (0.05 sec)
Rows matched: 5  Changed: 5  Warnings: 0

mysql> select * from student;
+------------+------------+------+------+-------+
| usn        | name       | sem  | sec  | fee   |
+------------+------------+------+------+-------+
| 4mh17cs087 | shirish    |    5 | c    | 50000 |
| 4mh17cs001 | subramanya |    7 | b    | 50000 |
| 4mh17cs102 | supreeth   |    5 | c    | 50000 |
| 4mh17cs070 | rohith     |    7 | b    | 50000 |
| 4mh17cs068 | thushar    |    5 | a    | 50000 |
+------------+------------+------+------+-------+
5 rows in set (0.00 sec)

mysql> update student set fee=30000
    -> where usn='4mh17cs102';
Query OK, 1 row affected (0.03 sec)
Rows matched: 1  Changed: 1  Warnings: 0

mysql> update student set fee=40000 where usn='4mh17cs087';
Query OK, 1 row affected (0.03 sec)
Rows matched: 1  Changed: 1  Warnings: 0

mysql> update student set fee=50000 where usn='4mh17cs001';
Query OK, 0 rows affected (0.02 sec)
Rows matched: 1  Changed: 0  Warnings: 0

mysql> update student set fee=60000 where usn='4mh17cs070';
Query OK, 1 row affected (0.04 sec)
Rows matched: 1  Changed: 1  Warnings: 0

mysql> update student set fee=70000 where usn='4mh17cs068';
Query OK, 1 row affected (0.03 sec)
Rows matched: 1  Changed: 1  Warnings: 0

mysql> select * from student;
+------------+------------+------+------+-------+
| usn        | name       | sem  | sec  | fee   |
+------------+------------+------+------+-------+
| 4mh17cs087 | shirish    |    5 | c    | 40000 |
| 4mh17cs001 | subramanya |    7 | b    | 50000 |
| 4mh17cs102 | supreeth   |    5 | c    | 30000 |
| 4mh17cs070 | rohith     |    7 | b    | 60000 |
| 4mh17cs068 | thushar    |    5 | a    | 70000 |
+------------+------------+------+------+-------+
5 rows in set (0.00 sec)

mysql> select max(fee) from student;
+----------+
| max(fee) |
+----------+
|    70000 |
+----------+
1 row in set (0.00 sec)

mysql> select min(fee) from student;
+----------+
| min(fee) |
+----------+
|    30000 |
+----------+
1 row in set (0.00 sec)

mysql> select avg(fee) from student;
+----------+
| avg(fee) |
+----------+
|    50000 |
+----------+
1 row in set (0.00 sec)

mysql> select sum(fee) as SUM_OF_FEE from student;
+------------+
| SUM_OF_FEE |
+------------+
|     250000 |
+------------+
1 row in set (0.00 sec)

mysql> select max(fee),min(fee),avg(fee) from student where sec='c';
+----------+----------+----------+
| max(fee) | min(fee) | avg(fee) |
+----------+----------+----------+
|    40000 |    30000 |    35000 |
+----------+----------+----------+
1 row in set (0.00 sec)

mysql> alter table student drop fee;
Query OK, 0 rows affected (0.52 sec)
Records: 0  Duplicates: 0  Warnings: 0

mysql> select * from student;
+------------+------------+------+------+
| usn        | name       | sem  | sec  |
+------------+------------+------+------+
| 4mh17cs087 | shirish    |    5 | c    |
| 4mh17cs001 | subramanya |    7 | b    |
| 4mh17cs102 | supreeth   |    5 | c    |
| 4mh17cs070 | rohith     |    7 | b    |
| 4mh17cs068 | thushar    |    5 | a    |
+------------+------------+------+------+
5 rows in set (0.00 sec)

mysql> delete from sudent;
ERROR 1146 (42S02): Table 'student.sudent' doesn't exist
mysql> delete from student;
Query OK, 5 rows affected (0.04 sec)

mysql> select * from student;
Empty set (0.00 sec)


